,contributors,coordinates,created_at,entities,favorite_count,favorited,geo,id,id_str,in_reply_to_screen_name,in_reply_to_status_id,in_reply_to_status_id_str,in_reply_to_user_id,in_reply_to_user_id_str,is_quote_status,lang,metadata,place,possibly_sensitive,retweet_count,retweeted,retweeted_status,source,text,truncated,user,sentimento
68,,,Wed May 30 21:49:39 +0000 2018,"{u'symbols': [], u'user_mentions': [{u'id': 313676150, u'indices': [3, 9], u'id_str': u'313676150', u'screen_name': u'brenu', u'name': u'brenu'}], u'hashtags': [], u'urls': []}",0,False,,1001943749222715392,1001943749222715392,,,,,,False,pt,"{u'iso_language_code': u'pt', u'result_type': u'recent'}",,,13,False,"{u'contributors': None, u'truncated': True, u'text': u'beleza todo mundo já entendeu que o lula (luiz inácio) eh lindo e bla bla bla
mas será se podemos falar de faustão… https://t.co/rRRi4mCGYq', u'is_quote_status': False, u'in_reply_to_status_id': 1001937379186405377, u'id': 1001943442367361024, u'favorite_count': 38, u'entities': {u'symbols': [], u'user_mentions': [], u'hashtags': [], u'urls': [{u'url': u'https://t.co/rRRi4mCGYq', u'indices': [116, 139], u'expanded_url': u'https://twitter.com/i/web/status/1001943442367361024', u'display_url': u'twitter.com/i/web/status/1\u2026'}]}, u'retweeted': False, u'coordinates': None, u'source': u'<a href=""http://twitter.com/download/android"" rel=""nofollow"">Twitter for Android</a>', u'in_reply_to_screen_name': u'brenu', u'in_reply_to_user_id': 313676150, u'retweet_count': 13, u'id_str': u'1001943442367361024', u'favorited': False, u'user': {u'follow_request_sent': False, u'has_extended_profile': True, u'profile_use_background_image': True, u'default_profile_image': False, u'id': 313676150, u'profile_background_image_url_https': u'https://abs.twimg.com/images/themes/theme14/bg.gif', u'verified': False, u'translator_type': u'regular', u'profile_text_color': u'333333', u'profile_image_url_https': u'https://pbs.twimg.com/profile_images/950852947180687361/XQl6lsxh_normal.jpg', u'profile_sidebar_fill_color': u'EFEFEF', u'entities': {u'description': {u'urls': []}}, u'followers_count': 21216, u'profile_sidebar_border_color': u'FFFFFF', u'id_str': u'313676150', u'profile_background_color': u'FFFFFF', u'listed_count': 183, u'is_translation_enabled': True, u'utc_offset': None, u'statuses_count': 40254, u'description': u'é preciso ter uma análise epistemológica sobre os fatos', u'friends_count': 262, u'location': u'', u'profile_link_color': u'1B95E0', u'profile_image_url': u'http://pbs.twimg.com/profile_images/950852947180687361/XQl6lsxh_normal.jpg', u'following': False, u'geo_enabled': True, u'profile_banner_url': u'https://pbs.twimg.com/profile_banners/313676150/1527360863', u'profile_background_image_url': u'http://abs.twimg.com/images/themes/theme14/bg.gif', u'screen_name': u'brenu', u'lang': u'pt', u'profile_background_tile': False, u'favourites_count': 20509, u'name': u'brenu', u'notifications': False, u'url': None, u'created_at': u'Thu Jun 09 01:31:20 +0000 2011', u'contributors_enabled': False, u'time_zone': None, u'protected': False, u'default_profile': False, u'is_translator': False}, u'geo': None, u'in_reply_to_user_id_str': u'313676150', u'possibly_sensitive': False, u'lang': u'pt', u'created_at': u'Wed May 30 21:48:26 +0000 2018', u'in_reply_to_status_id_str': u'1001937379186405377', u'place': None, u'metadata': {u'iso_language_code': u'pt', u'result_type': u'recent'}}","<a href=""http://twitter.com"" rel=""nofollow"">Twitter Web Client</a>","RT @brenu: beleza todo mundo já entendeu que o lula (luiz inácio) eh lindo e bla bla bla
mas será se podemos falar de faustão (fausto silva…",False,"{u'follow_request_sent': False, u'has_extended_profile': False, u'profile_use_background_image': True, u'default_profile_image': False, u'id': 100837662, u'profile_background_image_url_https': u'https://abs.twimg.com/images/themes/theme9/bg.gif', u'verified': False, u'translator_type': u'none', u'profile_text_color': u'9B10E0', u'profile_image_url_https': u'https://pbs.twimg.com/profile_images/487905342576017408/JbnP5fM2_normal.jpeg', u'profile_sidebar_fill_color': u'000000', u'entities': {u'url': {u'urls': [{u'url': u'http://t.co/POy021hZ3s', u'indices': [0, 22], u'expanded_url': u'http://emptybottlesofcoke.tumblr.com', u'display_url': u'emptybottlesofcoke.tumblr.com'}]}, u'description': {u'urls': []}}, u'followers_count': 183, u'profile_sidebar_border_color': u'000000', u'id_str': u'100837662', u'profile_background_color': u'000000', u'listed_count': 5, u'is_translation_enabled': False, u'utc_offset': None, u'statuses_count': 12175, u'description': u'', u'friends_count': 368, u'location': u'somewhere', u'profile_link_color': u'FF0000', u'profile_image_url': u'http://pbs.twimg.com/profile_images/487905342576017408/JbnP5fM2_normal.jpeg', u'following': False, u'geo_enabled': False, u'profile_banner_url': u'https://pbs.twimg.com/profile_banners/100837662/1372466024', u'profile_background_image_url': u'http://abs.twimg.com/images/themes/theme9/bg.gif', u'screen_name': u'priscicodelismo', u'lang': u'en', u'profile_background_tile': True, u'favourites_count': 2, u'name': u'wonderland's rabbit', u'notifications': False, u'url': u'http://t.co/POy021hZ3s', u'created_at': u'Thu Dec 31 20:19:57 +0000 2009', u'contributors_enabled': False, u'time_zone': None, u'protected': False, u'default_profile': False, u'is_translator': False}",2.0
69,,,Wed May 30 21:49:14 +0000 2018,"{u'symbols': [], u'user_mentions': [{u'id': 541156738, u'indices': [3, 19], u'id_str': u'541156738', u'screen_name': u'MariluParreiras', u'name': u'#LulaRousseff'}], u'hashtags': [], u'urls': []}",0,False,,1001943642360205313,1001943642360205313,,,,,,False,pt,"{u'iso_language_code': u'pt', u'result_type': u'recent'}",,,5,False,"{u'contributors': None, u'truncated': True, u'text': u'TACLA DURAN FINALMENTE SERÁ OUVIDO … O advogado e ex-consultor Rodrigo Tacla Duran, que realizou serviços como advo… https://t.co/GfL6MASdEw', u'is_quote_status': False, u'in_reply_to_status_id': None, u'id': 1001941756420808705, u'favorite_count': 5, u'entities': {u'symbols': [], u'user_mentions': [], u'hashtags': [], u'urls': [{u'url': u'https://t.co/GfL6MASdEw', u'indices': [117, 140], u'expanded_url': u'https://twitter.com/i/web/status/1001941756420808705', u'display_url': u'twitter.com/i/web/status/1\u2026'}]}, u'retweeted': False, u'coordinates': None, u'source': u'<a href=""http://twitter.com/download/android"" rel=""nofollow"">Twitter for Android</a>', u'in_reply_to_screen_name': None, u'in_reply_to_user_id': None, u'retweet_count': 5, u'id_str': u'1001941756420808705', u'favorited': False, u'user': {u'follow_request_sent': False, u'has_extended_profile': True, u'profile_use_background_image': False, u'default_profile_image': False, u'id': 541156738, u'profile_background_image_url_https': u'https://abs.twimg.com/images/themes/theme1/bg.png', u'verified': False, u'translator_type': u'none', u'profile_text_color': u'000000', u'profile_image_url_https': u'https://pbs.twimg.com/profile_images/974329154681229313/5sp7Vt9b_normal.jpg', u'profile_sidebar_fill_color': u'000000', u'entities': {u'description': {u'urls': []}}, u'followers_count': 9093, u'profile_sidebar_border_color': u'000000', u'id_str': u'541156738', u'profile_background_color': u'000000', u'listed_count': 42, u'is_translation_enabled': False, u'utc_offset': None, u'statuses_count': 175312, u'description': u'Tuiteira independente, em busca de um mundo melhor para todos. O mundo é um grande QUINTAL.', u'friends_count': 3834, u'location': u'BRASIL/RJ', u'profile_link_color': u'19CF86', u'profile_image_url': u'http://pbs.twimg.com/profile_images/974329154681229313/5sp7Vt9b_normal.jpg', u'following': False, u'geo_enabled': True, u'profile_banner_url': u'https://pbs.twimg.com/profile_banners/541156738/1523131732', u'profile_background_image_url': u'http://abs.twimg.com/images/themes/theme1/bg.png', u'screen_name': u'MariluParreiras', u'lang': u'pt', u'profile_background_tile': False, u'favourites_count': 118903, u'name': u'#LulaRousseff', u'notifications': False, u'url': None, u'created_at': u'Fri Mar 30 21:53:59 +0000 2012', u'contributors_enabled': False, u'time_zone': None, u'protected': False, u'default_profile': False, u'is_translator': False}, u'geo': None, u'in_reply_to_user_id_str': None, u'lang': u'pt', u'created_at': u'Wed May 30 21:41:44 +0000 2018', u'in_reply_to_status_id_str': None, u'place': None, u'metadata': {u'iso_language_code': u'pt', u'result_type': u'recent'}}","<a href=""http://twitter.com/download/android"" rel=""nofollow"">Twitter for Android</a>","RT @MariluParreiras: TACLA DURAN FINALMENTE SERÁ OUVIDO … O advogado e ex-consultor Rodrigo Tacla Duran, que realizou serviços como advogad…",False,"{u'follow_request_sent': False, u'has_extended_profile': False, u'profile_use_background_image': True, u'default_profile_image': False, u'id': 710292950970982400, u'profile_background_image_url_https': None, u'verified': False, u'translator_type': u'none', u'profile_text_color': u'333333', u'profile_image_url_https': u'https://pbs.twimg.com/profile_images/990226941746794496/TImXP6Sm_normal.jpg', u'profile_sidebar_fill_color': u'DDEEF6', u'entities': {u'description': {u'urls': []}}, u'followers_count': 1372, u'profile_sidebar_border_color': u'C0DEED', u'id_str': u'710292950970982400', u'profile_background_color': u'F5F8FA', u'listed_count': 18, u'is_translation_enabled': False, u'utc_offset': None, u'statuses_count': 59375, u'description': u''No Brasil o fundo do poço é apenas uma etapa.'

Luis Fernando Veríssimo', u'friends_count': 2130, u'location': u'Goiânia, Brasil', u'profile_link_color': u'1DA1F2', u'profile_image_url': u'http://pbs.twimg.com/profile_images/990226941746794496/TImXP6Sm_normal.jpg', u'following': False, u'geo_enabled': False, u'profile_banner_url': u'https://pbs.twimg.com/profile_banners/710292950970982400/1523231176', u'profile_background_image_url': None, u'screen_name': u'rose38705916', u'lang': u'pt', u'profile_background_tile': False, u'favourites_count': 20390, u'name': u'LULA Livre', u'notifications': False, u'url': None, u'created_at': u'Thu Mar 17 02:33:30 +0000 2016', u'contributors_enabled': False, u'time_zone': None, u'protected': False, u'default_profile': True, u'is_translator': False}",0.0
70,,,Wed May 30 21:48:26 +0000 2018,"{u'symbols': [], u'user_mentions': [], u'hashtags': [], u'urls': [{u'url': u'https://t.co/rRRi4mCGYq', u'indices': [116, 139], u'expanded_url': u'https://twitter.com/i/web/status/1001943442367361024', u'display_url': u'twitter.com/i/web/status/1…'}]}",38,False,,1001943442367361024,1001943442367361024,brenu,1.0019373791864054e+18,1.0019373791864054e+18,313676150.0,313676150.0,False,pt,"{u'iso_language_code': u'pt', u'result_type': u'recent'}",,False,13,False,,"<a href=""http://twitter.com/download/android"" rel=""nofollow"">Twitter for Android</a>","beleza todo mundo já entendeu que o lula (luiz inácio) eh lindo e bla bla bla
mas será se podemos falar de faustão… https://t.co/rRRi4mCGYq",True,"{u'follow_request_sent': False, u'has_extended_profile': True, u'profile_use_background_image': True, u'default_profile_image': False, u'id': 313676150, u'profile_background_image_url_https': u'https://abs.twimg.com/images/themes/theme14/bg.gif', u'verified': False, u'translator_type': u'regular', u'profile_text_color': u'333333', u'profile_image_url_https': u'https://pbs.twimg.com/profile_images/950852947180687361/XQl6lsxh_normal.jpg', u'profile_sidebar_fill_color': u'EFEFEF', u'entities': {u'description': {u'urls': []}}, u'followers_count': 21216, u'profile_sidebar_border_color': u'FFFFFF', u'id_str': u'313676150', u'profile_background_color': u'FFFFFF', u'listed_count': 183, u'is_translation_enabled': True, u'utc_offset': None, u'statuses_count': 40254, u'description': u'é preciso ter uma análise epistemológica sobre os fatos', u'friends_count': 262, u'location': u'', u'profile_link_color': u'1B95E0', u'profile_image_url': u'http://pbs.twimg.com/profile_images/950852947180687361/XQl6lsxh_normal.jpg', u'following': False, u'geo_enabled': True, u'profile_banner_url': u'https://pbs.twimg.com/profile_banners/313676150/1527360863', u'profile_background_image_url': u'http://abs.twimg.com/images/themes/theme14/bg.gif', u'screen_name': u'brenu', u'lang': u'pt', u'profile_background_tile': False, u'favourites_count': 20509, u'name': u'brenu', u'notifications': False, u'url': None, u'created_at': u'Thu Jun 09 01:31:20 +0000 2011', u'contributors_enabled': False, u'time_zone': None, u'protected': False, u'default_profile': False, u'is_translator': False}",2.0
71,,,Wed May 30 21:45:16 +0000 2018,"{u'symbols': [], u'user_mentions': [{u'id': 541156738, u'indices': [3, 19], u'id_str': u'541156738', u'screen_name': u'MariluParreiras', u'name': u'#LulaRousseff'}], u'hashtags': [], u'urls': []}",0,False,,1001942643327275009,1001942643327275009,,,,,,False,pt,"{u'iso_language_code': u'pt', u'result_type': u'recent'}",,,5,False,"{u'contributors': None, u'truncated': True, u'text': u'TACLA DURAN FINALMENTE SERÁ OUVIDO … O advogado e ex-consultor Rodrigo Tacla Duran, que realizou serviços como advo… https://t.co/GfL6MASdEw', u'is_quote_status': False, u'in_reply_to_status_id': None, u'id': 1001941756420808705, u'favorite_count': 5, u'entities': {u'symbols': [], u'user_mentions': [], u'hashtags': [], u'urls': [{u'url': u'https://t.co/GfL6MASdEw', u'indices': [117, 140], u'expanded_url': u'https://twitter.com/i/web/status/1001941756420808705', u'display_url': u'twitter.com/i/web/status/1\u2026'}]}, u'retweeted': False, u'coordinates': None, u'source': u'<a href=""http://twitter.com/download/android"" rel=""nofollow"">Twitter for Android</a>', u'in_reply_to_screen_name': None, u'in_reply_to_user_id': None, u'retweet_count': 5, u'id_str': u'1001941756420808705', u'favorited': False, u'user': {u'follow_request_sent': False, u'has_extended_profile': True, u'profile_use_background_image': False, u'default_profile_image': False, u'id': 541156738, u'profile_background_image_url_https': u'https://abs.twimg.com/images/themes/theme1/bg.png', u'verified': False, u'translator_type': u'none', u'profile_text_color': u'000000', u'profile_image_url_https': u'https://pbs.twimg.com/profile_images/974329154681229313/5sp7Vt9b_normal.jpg', u'profile_sidebar_fill_color': u'000000', u'entities': {u'description': {u'urls': []}}, u'followers_count': 9093, u'profile_sidebar_border_color': u'000000', u'id_str': u'541156738', u'profile_background_color': u'000000', u'listed_count': 42, u'is_translation_enabled': False, u'utc_offset': None, u'statuses_count': 175312, u'description': u'Tuiteira independente, em busca de um mundo melhor para todos. O mundo é um grande QUINTAL.', u'friends_count': 3834, u'location': u'BRASIL/RJ', u'profile_link_color': u'19CF86', u'profile_image_url': u'http://pbs.twimg.com/profile_images/974329154681229313/5sp7Vt9b_normal.jpg', u'following': False, u'geo_enabled': True, u'profile_banner_url': u'https://pbs.twimg.com/profile_banners/541156738/1523131732', u'profile_background_image_url': u'http://abs.twimg.com/images/themes/theme1/bg.png', u'screen_name': u'MariluParreiras', u'lang': u'pt', u'profile_background_tile': False, u'favourites_count': 118903, u'name': u'#LulaRousseff', u'notifications': False, u'url': None, u'created_at': u'Fri Mar 30 21:53:59 +0000 2012', u'contributors_enabled': False, u'time_zone': None, u'protected': False, u'default_profile': False, u'is_translator': False}, u'geo': None, u'in_reply_to_user_id_str': None, u'lang': u'pt', u'created_at': u'Wed May 30 21:41:44 +0000 2018', u'in_reply_to_status_id_str': None, u'place': None, u'metadata': {u'iso_language_code': u'pt', u'result_type': u'recent'}}","<a href=""http://twitter.com/download/android"" rel=""nofollow"">Twitter for Android</a>","RT @MariluParreiras: TACLA DURAN FINALMENTE SERÁ OUVIDO … O advogado e ex-consultor Rodrigo Tacla Duran, que realizou serviços como advogad…",False,"{u'follow_request_sent': False, u'has_extended_profile': False, u'profile_use_background_image': True, u'default_profile_image': True, u'id': 884921137934860288, u'profile_background_image_url_https': None, u'verified': False, u'translator_type': u'none', u'profile_text_color': u'333333', u'profile_image_url_https': u'https://abs.twimg.com/sticky/default_profile_images/default_profile_normal.png', u'profile_sidebar_fill_color': u'DDEEF6', u'entities': {u'description': {u'urls': []}}, u'followers_count': 408, u'profile_sidebar_border_color': u'C0DEED', u'id_str': u'884921137934860288', u'profile_background_color': u'F5F8FA', u'listed_count': 0, u'is_translation_enabled': False, u'utc_offset': None, u'statuses_count': 71739, u'description': u'', u'friends_count': 182, u'location': u'', u'profile_link_color': u'1DA1F2', u'profile_image_url': u'http://abs.twimg.com/sticky/default_profile_images/default_profile_normal.png', u'following': False, u'geo_enabled': False, u'profile_background_image_url': None, u'screen_name': u'Marliblue1', u'lang': u'pt', u'profile_background_tile': False, u'favourites_count': 84647, u'name': u'Marli Nogueira', u'notifications': False, u'url': None, u'created_at': u'Tue Jul 11 23:43:35 +0000 2017', u'contributors_enabled': False, u'time_zone': None, u'protected': False, u'default_profile': True, u'is_translator': False}",0.0
72,,,Wed May 30 21:43:58 +0000 2018,"{u'symbols': [], u'user_mentions': [{u'id': 118864905, u'indices': [3, 13], u'id_str': u'118864905', u'screen_name': u'VTVcanal8', u'name': u'VTV CANAL 8'}], u'hashtags': [], u'urls': []}",0,False,,1001942316339351552,1001942316339351552,,,,,,False,es,"{u'iso_language_code': u'es', u'result_type': u'recent'}",,,403,False,"{u'contributors': None, u'truncated': True, u'text': u'INTERNACIONALES | El Tribunal Regional Federal de la Tercera Región de Brasil, ordenó la restitución de sus derecho… https://t.co/49RKnb9FYb', u'is_quote_status': False, u'in_reply_to_status_id': None, u'id': 1001836981532463104, u'favorite_count': 207, u'entities': {u'symbols': [], u'user_mentions': [], u'hashtags': [], u'urls': [{u'url': u'https://t.co/49RKnb9FYb', u'indices': [117, 140], u'expanded_url': u'https://twitter.com/i/web/status/1001836981532463104', u'display_url': u'twitter.com/i/web/status/1\u2026'}]}, u'retweeted': False, u'coordinates': None, u'source': u'<a href=""http://twitter.com"" rel=""nofollow"">Twitter Web Client</a>', u'in_reply_to_screen_name': None, u'in_reply_to_user_id': None, u'retweet_count': 403, u'id_str': u'1001836981532463104', u'favorited': False, u'user': {u'follow_request_sent': False, u'has_extended_profile': True, u'profile_use_background_image': False, u'default_profile_image': False, u'id': 118864905, u'profile_background_image_url_https': u'https://abs.twimg.com/images/themes/theme17/bg.gif', u'verified': True, u'translator_type': u'regular', u'profile_text_color': u'333333', u'profile_image_url_https': u'https://pbs.twimg.com/profile_images/917506292423344129/_5qaXsUk_normal.jpg', u'profile_sidebar_fill_color': u'E6F6F9', u'entities': {u'url': {u'urls': [{u'url': u'https://t.co/m6LaVCRB7I', u'indices': [0, 23], u'expanded_url': u'http://vtv.gob.ve', u'display_url': u'vtv.gob.ve'}]}, u'description': {u'urls': [{u'url': u'https://t.co/a5JJYTXIYk', u'indices': [61, 84], u'expanded_url': u'http://facebook.com/VTVtuCanal', u'display_url': u'facebook.com/VTVtuCanal'}, {u'url': u'https://t.co/ej8nGm7m4t', u'indices': [87, 110], u'expanded_url': u'http://youtube.com/MultimedioVTV', u'display_url': u'youtube.com/MultimedioVTV'}, {u'url': u'https://t.co/hCy05R9VFU', u'indices': [113, 136], u'expanded_url': u'http://instagram.com/VTVcanal8', u'display_url': u'instagram.com/VTVcanal8'}]}}, u'followers_count': 1514220, u'profile_sidebar_border_color': u'000000', u'id_str': u'118864905', u'profile_background_color': u'ABB8C2', u'listed_count': 6327, u'is_translation_enabled': True, u'utc_offset': None, u'statuses_count': 695699, u'description': u'Somos Venezolana de Televisión, 24 horas en vivo | Síguenos  https://t.co/a5JJYTXIYk | https://t.co/ej8nGm7m4t | https://t.co/hCy05R9VFU', u'friends_count': 531, u'location': u'Venezuela', u'profile_link_color': u'1B95E0', u'profile_image_url': u'http://pbs.twimg.com/profile_images/917506292423344129/_5qaXsUk_normal.jpg', u'following': False, u'geo_enabled': True, u'profile_banner_url': u'https://pbs.twimg.com/profile_banners/118864905/1527167189', u'profile_background_image_url': u'http://abs.twimg.com/images/themes/theme17/bg.gif', u'screen_name': u'VTVcanal8', u'lang': u'es', u'profile_background_tile': True, u'favourites_count': 1452, u'name': u'VTV CANAL 8', u'notifications': False, u'url': u'https://t.co/m6LaVCRB7I', u'created_at': u'Mon Mar 01 23:44:14 +0000 2010', u'contributors_enabled': False, u'time_zone': None, u'protected': False, u'default_profile': False, u'is_translator': False}, u'geo': None, u'in_reply_to_user_id_str': None, u'possibly_sensitive': False, u'lang': u'es', u'created_at': u'Wed May 30 14:45:24 +0000 2018', u'in_reply_to_status_id_str': None, u'place': {u'country_code': u'VE', u'url': u'https://api.twitter.com/1.1/geo/id/043383f8b2b79918.json', u'country': u'Venezuela', u'place_type': u'country', u'bounding_box': {u'type': u'Polygon', u'coordinates': [[[-73.3540725, 0.648837], [-59.8037796, 0.648837], [-59.8037796, 12.1968022], [-73.3540725, 12.1968022]]]}, u'contained_within': [], u'full_name': u'Venezuela', u'attributes': {}, u'id': u'043383f8b2b79918', u'name': u'Venezuela'}, u'metadata': {u'iso_language_code': u'es', u'result_type': u'recent'}}","<a href=""http://twitter.com"" rel=""nofollow"">Twitter Web Client</a>","RT @VTVcanal8: INTERNACIONALES | El Tribunal Regional Federal de la Tercera Región de Brasil, ordenó la restitución de sus derechos como ex…",False,"{u'follow_request_sent': False, u'has_extended_profile': False, u'profile_use_background_image': True, u'default_profile_image': False, u'id': 974685641031258112, u'profile_background_image_url_https': None, u'verified': False, u'translator_type': u'none', u'profile_text_color': u'333333', u'profile_image_url_https': u'https://pbs.twimg.com/profile_images/975227808569085952/Po5w_LmM_normal.jpg', u'profile_sidebar_fill_color': u'DDEEF6', u'entities': {u'description': {u'urls': []}}, u'followers_count': 721, u'profile_sidebar_border_color': u'C0DEED', u'id_str': u'974685641031258112', u'profile_background_color': u'F5F8FA', u'listed_count': 0, u'is_translation_enabled': False, u'utc_offset': None, u'statuses_count': 1775, u'description': u'Actor. Director del Grupo de Teatro Trazos. Militante de la Revolución Permanente. Las cosas no son de quién las tiene, sino de Quién las Necesita. Hijo de Toña', u'friends_count': 791, u'location': u'', u'profile_link_color': u'1DA1F2', u'profile_image_url': u'http://pbs.twimg.com/profile_images/975227808569085952/Po5w_LmM_normal.jpg', u'following': False, u'geo_enabled': False, u'profile_banner_url': u'https://pbs.twimg.com/profile_banners/974685641031258112/1521347209', u'profile_background_image_url': None, u'screen_name': u'franklinkvargas', u'lang': u'es', u'profile_background_tile': False, u'favourites_count': 280, u'name': u'Franklin Rafael Vargas', u'notifications': False, u'url': None, u'created_at': u'Fri Mar 16 16:35:40 +0000 2018', u'contributors_enabled': False, u'time_zone': None, u'protected': False, u'default_profile': True, u'is_translator': False}",0.0
73,,,Wed May 30 21:41:44 +0000 2018,"{u'symbols': [], u'user_mentions': [], u'hashtags': [], u'urls': [{u'url': u'https://t.co/GfL6MASdEw', u'indices': [117, 140], u'expanded_url': u'https://twitter.com/i/web/status/1001941756420808705', u'display_url': u'twitter.com/i/web/status/1…'}]}",5,False,,1001941756420808705,1001941756420808705,,,,,,False,pt,"{u'iso_language_code': u'pt', u'result_type': u'recent'}",,,5,False,,"<a href=""http://twitter.com/download/android"" rel=""nofollow"">Twitter for Android</a>","TACLA DURAN FINALMENTE SERÁ OUVIDO … O advogado e ex-consultor Rodrigo Tacla Duran, que realizou serviços como advo… https://t.co/GfL6MASdEw",True,"{u'follow_request_sent': False, u'has_extended_profile': True, u'profile_use_background_image': False, u'default_profile_image': False, u'id': 541156738, u'profile_background_image_url_https': u'https://abs.twimg.com/images/themes/theme1/bg.png', u'verified': False, u'translator_type': u'none', u'profile_text_color': u'000000', u'profile_image_url_https': u'https://pbs.twimg.com/profile_images/974329154681229313/5sp7Vt9b_normal.jpg', u'profile_sidebar_fill_color': u'000000', u'entities': {u'description': {u'urls': []}}, u'followers_count': 9093, u'profile_sidebar_border_color': u'000000', u'id_str': u'541156738', u'profile_background_color': u'000000', u'listed_count': 42, u'is_translation_enabled': False, u'utc_offset': None, u'statuses_count': 175312, u'description': u'Tuiteira independente, em busca de um mundo melhor para todos. O mundo é um grande QUINTAL.', u'friends_count': 3834, u'location': u'BRASIL/RJ', u'profile_link_color': u'19CF86', u'profile_image_url': u'http://pbs.twimg.com/profile_images/974329154681229313/5sp7Vt9b_normal.jpg', u'following': False, u'geo_enabled': True, u'profile_banner_url': u'https://pbs.twimg.com/profile_banners/541156738/1523131732', u'profile_background_image_url': u'http://abs.twimg.com/images/themes/theme1/bg.png', u'screen_name': u'MariluParreiras', u'lang': u'pt', u'profile_background_tile': False, u'favourites_count': 118903, u'name': u'#LulaRousseff', u'notifications': False, u'url': None, u'created_at': u'Fri Mar 30 21:53:59 +0000 2012', u'contributors_enabled': False, u'time_zone': None, u'protected': False, u'default_profile': False, u'is_translator': False}",0.0
