,contributors,coordinates,created_at,entities,favorite_count,favorited,geo,id,id_str,in_reply_to_screen_name,in_reply_to_status_id,in_reply_to_status_id_str,in_reply_to_user_id,in_reply_to_user_id_str,is_quote_status,lang,metadata,place,possibly_sensitive,retweet_count,retweeted,retweeted_status,source,text,truncated,user,sentimento
25,,,Wed May 30 23:21:13 +0000 2018,"{u'symbols': [], u'user_mentions': [{u'id': 118864905, u'indices': [3, 13], u'id_str': u'118864905', u'screen_name': u'VTVcanal8', u'name': u'VTV CANAL 8'}], u'hashtags': [], u'urls': []}",0,False,,1001966793500524545,1001966793500524545,,,,,,False,es,"{u'iso_language_code': u'es', u'result_type': u'recent'}",,,403,False,"{u'contributors': None, u'truncated': True, u'text': u'INTERNACIONALES | El Tribunal Regional Federal de la Tercera Región de Brasil, ordenó la restitución de sus derecho… https://t.co/49RKnb9FYb', u'is_quote_status': False, u'in_reply_to_status_id': None, u'id': 1001836981532463104, u'favorite_count': 207, u'entities': {u'symbols': [], u'user_mentions': [], u'hashtags': [], u'urls': [{u'url': u'https://t.co/49RKnb9FYb', u'indices': [117, 140], u'expanded_url': u'https://twitter.com/i/web/status/1001836981532463104', u'display_url': u'twitter.com/i/web/status/1\u2026'}]}, u'retweeted': False, u'coordinates': None, u'source': u'<a href=""http://twitter.com"" rel=""nofollow"">Twitter Web Client</a>', u'in_reply_to_screen_name': None, u'in_reply_to_user_id': None, u'retweet_count': 403, u'id_str': u'1001836981532463104', u'favorited': False, u'user': {u'follow_request_sent': False, u'has_extended_profile': True, u'profile_use_background_image': False, u'default_profile_image': False, u'id': 118864905, u'profile_background_image_url_https': u'https://abs.twimg.com/images/themes/theme17/bg.gif', u'verified': True, u'translator_type': u'regular', u'profile_text_color': u'333333', u'profile_image_url_https': u'https://pbs.twimg.com/profile_images/917506292423344129/_5qaXsUk_normal.jpg', u'profile_sidebar_fill_color': u'E6F6F9', u'entities': {u'url': {u'urls': [{u'url': u'https://t.co/m6LaVCRB7I', u'indices': [0, 23], u'expanded_url': u'http://vtv.gob.ve', u'display_url': u'vtv.gob.ve'}]}, u'description': {u'urls': [{u'url': u'https://t.co/a5JJYTXIYk', u'indices': [61, 84], u'expanded_url': u'http://facebook.com/VTVtuCanal', u'display_url': u'facebook.com/VTVtuCanal'}, {u'url': u'https://t.co/ej8nGm7m4t', u'indices': [87, 110], u'expanded_url': u'http://youtube.com/MultimedioVTV', u'display_url': u'youtube.com/MultimedioVTV'}, {u'url': u'https://t.co/hCy05R9VFU', u'indices': [113, 136], u'expanded_url': u'http://instagram.com/VTVcanal8', u'display_url': u'instagram.com/VTVcanal8'}]}}, u'followers_count': 1514220, u'profile_sidebar_border_color': u'000000', u'id_str': u'118864905', u'profile_background_color': u'ABB8C2', u'listed_count': 6327, u'is_translation_enabled': True, u'utc_offset': None, u'statuses_count': 695699, u'description': u'Somos Venezolana de Televisión, 24 horas en vivo | Síguenos  https://t.co/a5JJYTXIYk | https://t.co/ej8nGm7m4t | https://t.co/hCy05R9VFU', u'friends_count': 531, u'location': u'Venezuela', u'profile_link_color': u'1B95E0', u'profile_image_url': u'http://pbs.twimg.com/profile_images/917506292423344129/_5qaXsUk_normal.jpg', u'following': False, u'geo_enabled': True, u'profile_banner_url': u'https://pbs.twimg.com/profile_banners/118864905/1527167189', u'profile_background_image_url': u'http://abs.twimg.com/images/themes/theme17/bg.gif', u'screen_name': u'VTVcanal8', u'lang': u'es', u'profile_background_tile': True, u'favourites_count': 1452, u'name': u'VTV CANAL 8', u'notifications': False, u'url': u'https://t.co/m6LaVCRB7I', u'created_at': u'Mon Mar 01 23:44:14 +0000 2010', u'contributors_enabled': False, u'time_zone': None, u'protected': False, u'default_profile': False, u'is_translator': False}, u'geo': None, u'in_reply_to_user_id_str': None, u'possibly_sensitive': False, u'lang': u'es', u'created_at': u'Wed May 30 14:45:24 +0000 2018', u'in_reply_to_status_id_str': None, u'place': {u'country_code': u'VE', u'url': u'https://api.twitter.com/1.1/geo/id/043383f8b2b79918.json', u'country': u'Venezuela', u'place_type': u'country', u'bounding_box': {u'type': u'Polygon', u'coordinates': [[[-73.3540725, 0.648837], [-59.8037796, 0.648837], [-59.8037796, 12.1968022], [-73.3540725, 12.1968022]]]}, u'contained_within': [], u'full_name': u'Venezuela', u'attributes': {}, u'id': u'043383f8b2b79918', u'name': u'Venezuela'}, u'metadata': {u'iso_language_code': u'es', u'result_type': u'recent'}}","<a href=""http://twitter.com/download/iphone"" rel=""nofollow"">Twitter for iPhone</a>","RT @VTVcanal8: INTERNACIONALES | El Tribunal Regional Federal de la Tercera Región de Brasil, ordenó la restitución de sus derechos como ex…",False,"{u'follow_request_sent': False, u'has_extended_profile': True, u'profile_use_background_image': True, u'default_profile_image': False, u'id': 2765858739, u'profile_background_image_url_https': u'https://abs.twimg.com/images/themes/theme1/bg.png', u'verified': False, u'translator_type': u'none', u'profile_text_color': u'333333', u'profile_image_url_https': u'https://pbs.twimg.com/profile_images/994045214233899008/y5jCOFfL_normal.jpg', u'profile_sidebar_fill_color': u'DDEEF6', u'entities': {u'description': {u'urls': []}}, u'followers_count': 81, u'profile_sidebar_border_color': u'C0DEED', u'id_str': u'2765858739', u'profile_background_color': u'C0DEED', u'listed_count': 1, u'is_translation_enabled': False, u'utc_offset': None, u'statuses_count': 2512, u'description': u'Cultora Popular Creadora de piezas únicas 💯 hecho a mano. 🇻🇪✊', u'friends_count': 275, u'location': u'Guarenas, Venezuela', u'profile_link_color': u'1DA1F2', u'profile_image_url': u'http://pbs.twimg.com/profile_images/994045214233899008/y5jCOFfL_normal.jpg', u'following': False, u'geo_enabled': True, u'profile_banner_url': u'https://pbs.twimg.com/profile_banners/2765858739/1525834260', u'profile_background_image_url': u'http://abs.twimg.com/images/themes/theme1/bg.png', u'screen_name': u'aguilamy2401', u'lang': u'es', u'profile_background_tile': False, u'favourites_count': 975, u'name': u'Amanecer Morales', u'notifications': False, u'url': None, u'created_at': u'Tue Sep 09 22:33:47 +0000 2014', u'contributors_enabled': False, u'time_zone': None, u'protected': False, u'default_profile': True, u'is_translator': False}",0.0
26,,,Wed May 30 23:21:04 +0000 2018,"{u'symbols': [], u'user_mentions': [{u'id': 118864905, u'indices': [3, 13], u'id_str': u'118864905', u'screen_name': u'VTVcanal8', u'name': u'VTV CANAL 8'}], u'hashtags': [], u'urls': []}",0,False,,1001966753793150976,1001966753793150976,,,,,,False,es,"{u'iso_language_code': u'es', u'result_type': u'recent'}",,,403,False,"{u'contributors': None, u'truncated': True, u'text': u'INTERNACIONALES | El Tribunal Regional Federal de la Tercera Región de Brasil, ordenó la restitución de sus derecho… https://t.co/49RKnb9FYb', u'is_quote_status': False, u'in_reply_to_status_id': None, u'id': 1001836981532463104, u'favorite_count': 207, u'entities': {u'symbols': [], u'user_mentions': [], u'hashtags': [], u'urls': [{u'url': u'https://t.co/49RKnb9FYb', u'indices': [117, 140], u'expanded_url': u'https://twitter.com/i/web/status/1001836981532463104', u'display_url': u'twitter.com/i/web/status/1\u2026'}]}, u'retweeted': False, u'coordinates': None, u'source': u'<a href=""http://twitter.com"" rel=""nofollow"">Twitter Web Client</a>', u'in_reply_to_screen_name': None, u'in_reply_to_user_id': None, u'retweet_count': 403, u'id_str': u'1001836981532463104', u'favorited': False, u'user': {u'follow_request_sent': False, u'has_extended_profile': True, u'profile_use_background_image': False, u'default_profile_image': False, u'id': 118864905, u'profile_background_image_url_https': u'https://abs.twimg.com/images/themes/theme17/bg.gif', u'verified': True, u'translator_type': u'regular', u'profile_text_color': u'333333', u'profile_image_url_https': u'https://pbs.twimg.com/profile_images/917506292423344129/_5qaXsUk_normal.jpg', u'profile_sidebar_fill_color': u'E6F6F9', u'entities': {u'url': {u'urls': [{u'url': u'https://t.co/m6LaVCRB7I', u'indices': [0, 23], u'expanded_url': u'http://vtv.gob.ve', u'display_url': u'vtv.gob.ve'}]}, u'description': {u'urls': [{u'url': u'https://t.co/a5JJYTXIYk', u'indices': [61, 84], u'expanded_url': u'http://facebook.com/VTVtuCanal', u'display_url': u'facebook.com/VTVtuCanal'}, {u'url': u'https://t.co/ej8nGm7m4t', u'indices': [87, 110], u'expanded_url': u'http://youtube.com/MultimedioVTV', u'display_url': u'youtube.com/MultimedioVTV'}, {u'url': u'https://t.co/hCy05R9VFU', u'indices': [113, 136], u'expanded_url': u'http://instagram.com/VTVcanal8', u'display_url': u'instagram.com/VTVcanal8'}]}}, u'followers_count': 1514220, u'profile_sidebar_border_color': u'000000', u'id_str': u'118864905', u'profile_background_color': u'ABB8C2', u'listed_count': 6327, u'is_translation_enabled': True, u'utc_offset': None, u'statuses_count': 695699, u'description': u'Somos Venezolana de Televisión, 24 horas en vivo | Síguenos  https://t.co/a5JJYTXIYk | https://t.co/ej8nGm7m4t | https://t.co/hCy05R9VFU', u'friends_count': 531, u'location': u'Venezuela', u'profile_link_color': u'1B95E0', u'profile_image_url': u'http://pbs.twimg.com/profile_images/917506292423344129/_5qaXsUk_normal.jpg', u'following': False, u'geo_enabled': True, u'profile_banner_url': u'https://pbs.twimg.com/profile_banners/118864905/1527167189', u'profile_background_image_url': u'http://abs.twimg.com/images/themes/theme17/bg.gif', u'screen_name': u'VTVcanal8', u'lang': u'es', u'profile_background_tile': True, u'favourites_count': 1452, u'name': u'VTV CANAL 8', u'notifications': False, u'url': u'https://t.co/m6LaVCRB7I', u'created_at': u'Mon Mar 01 23:44:14 +0000 2010', u'contributors_enabled': False, u'time_zone': None, u'protected': False, u'default_profile': False, u'is_translator': False}, u'geo': None, u'in_reply_to_user_id_str': None, u'possibly_sensitive': False, u'lang': u'es', u'created_at': u'Wed May 30 14:45:24 +0000 2018', u'in_reply_to_status_id_str': None, u'place': {u'country_code': u'VE', u'url': u'https://api.twitter.com/1.1/geo/id/043383f8b2b79918.json', u'country': u'Venezuela', u'place_type': u'country', u'bounding_box': {u'type': u'Polygon', u'coordinates': [[[-73.3540725, 0.648837], [-59.8037796, 0.648837], [-59.8037796, 12.1968022], [-73.3540725, 12.1968022]]]}, u'contained_within': [], u'full_name': u'Venezuela', u'attributes': {}, u'id': u'043383f8b2b79918', u'name': u'Venezuela'}, u'metadata': {u'iso_language_code': u'es', u'result_type': u'recent'}}","<a href=""http://twitter.com/download/android"" rel=""nofollow"">Twitter for Android</a>","RT @VTVcanal8: INTERNACIONALES | El Tribunal Regional Federal de la Tercera Región de Brasil, ordenó la restitución de sus derechos como ex…",False,"{u'follow_request_sent': False, u'has_extended_profile': False, u'profile_use_background_image': True, u'default_profile_image': False, u'id': 866852902337486849, u'profile_background_image_url_https': None, u'verified': False, u'translator_type': u'none', u'profile_text_color': u'333333', u'profile_image_url_https': u'https://pbs.twimg.com/profile_images/913770940911235072/Mwwqaubh_normal.jpg', u'profile_sidebar_fill_color': u'DDEEF6', u'entities': {u'description': {u'urls': []}}, u'followers_count': 196, u'profile_sidebar_border_color': u'C0DEED', u'id_str': u'866852902337486849', u'profile_background_color': u'F5F8FA', u'listed_count': 0, u'is_translation_enabled': False, u'utc_offset': None, u'statuses_count': 3417, u'description': u'Soy chavista por convicción revolucionario hasta los huesos y amo esta patria', u'friends_count': 402, u'location': u'', u'profile_link_color': u'1DA1F2', u'profile_image_url': u'http://pbs.twimg.com/profile_images/913770940911235072/Mwwqaubh_normal.jpg', u'following': False, u'geo_enabled': False, u'profile_background_image_url': None, u'screen_name': u'William47914019', u'lang': u'es', u'profile_background_tile': False, u'favourites_count': 524, u'name': u'William Eduardo Urib', u'notifications': False, u'url': None, u'created_at': u'Tue May 23 03:06:52 +0000 2017', u'contributors_enabled': False, u'time_zone': None, u'protected': False, u'default_profile': True, u'is_translator': False}",0.0
27,,,Wed May 30 23:13:58 +0000 2018,"{u'symbols': [], u'user_mentions': [{u'id': 111123176, u'indices': [3, 19], u'id_str': u'111123176', u'screen_name': u'jeanwyllys_real', u'name': u'Jean Wyllys'}], u'hashtags': [], u'urls': []}",0,False,,1001964966583336960,1001964966583336960,,,,,,False,pt,"{u'iso_language_code': u'pt', u'result_type': u'recent'}",,,213,False,"{u'contributors': None, u'truncated': True, u'text': u'300 acadêmicos e intelectuais lançaram um manifesto  denunciando a prisão do ex-presidente Luiz Inácio Lula da Silv… https://t.co/t0fceWR0pE', u'is_quote_status': False, u'in_reply_to_status_id': None, u'id': 1001629096638631936, u'favorite_count': 692, u'entities': {u'symbols': [], u'user_mentions': [], u'hashtags': [], u'urls': [{u'url': u'https://t.co/t0fceWR0pE', u'indices': [117, 140], u'expanded_url': u'https://twitter.com/i/web/status/1001629096638631936', u'display_url': u'twitter.com/i/web/status/1\u2026'}]}, u'retweeted': False, u'coordinates': None, u'source': u'<a href=""http://twitter.com/download/android"" rel=""nofollow"">Twitter for Android</a>', u'in_reply_to_screen_name': None, u'in_reply_to_user_id': None, u'retweet_count': 213, u'id_str': u'1001629096638631936', u'favorited': False, u'user': {u'follow_request_sent': False, u'has_extended_profile': False, u'profile_use_background_image': True, u'default_profile_image': False, u'id': 111123176, u'profile_background_image_url_https': u'https://abs.twimg.com/images/themes/theme1/bg.png', u'verified': True, u'translator_type': u'none', u'profile_text_color': u'333333', u'profile_image_url_https': u'https://pbs.twimg.com/profile_images/974363284295077890/DRBkhPqv_normal.jpg', u'profile_sidebar_fill_color': u'DDEEF6', u'entities': {u'url': {u'urls': [{u'url': u'https://t.co/SCfeqdpVBC', u'indices': [0, 23], u'expanded_url': u'http://bit.ly/FinancieJeanWyllys', u'display_url': u'bit.ly/FinancieJeanWy\u2026'}]}, u'description': {u'urls': []}}, u'followers_count': 706215, u'profile_sidebar_border_color': u'C0DEED', u'id_str': u'111123176', u'profile_background_color': u'C0DEED', u'listed_count': 2345, u'is_translation_enabled': False, u'utc_offset': None, u'statuses_count': 65094, u'description': u'Jornalista, professor universitário e escritor baiano. Pré-candidato a deputado federal pelo PSOL-RJ.
Doe aqui 👇 para a nossa futura campanha!', u'friends_count': 711, u'location': u'Rio de Janeiro', u'profile_link_color': u'3B94D9', u'profile_image_url': u'http://pbs.twimg.com/profile_images/974363284295077890/DRBkhPqv_normal.jpg', u'following': False, u'geo_enabled': True, u'profile_banner_url': u'https://pbs.twimg.com/profile_banners/111123176/1526939321', u'profile_background_image_url': u'http://abs.twimg.com/images/themes/theme1/bg.png', u'screen_name': u'jeanwyllys_real', u'lang': u'pt', u'profile_background_tile': True, u'favourites_count': 855, u'name': u'Jean Wyllys', u'notifications': False, u'url': u'https://t.co/SCfeqdpVBC', u'created_at': u'Wed Feb 03 21:58:06 +0000 2010', u'contributors_enabled': False, u'time_zone': None, u'protected': False, u'default_profile': False, u'is_translator': False}, u'geo': None, u'in_reply_to_user_id_str': None, u'possibly_sensitive': False, u'lang': u'pt', u'created_at': u'Wed May 30 00:59:20 +0000 2018', u'in_reply_to_status_id_str': None, u'place': None, u'metadata': {u'iso_language_code': u'pt', u'result_type': u'recent'}}","<a href=""http://twitter.com/download/iphone"" rel=""nofollow"">Twitter for iPhone</a>",RT @jeanwyllys_real: 300 acadêmicos e intelectuais lançaram um manifesto  denunciando a prisão do ex-presidente Luiz Inácio Lula da Silva.…,False,"{u'follow_request_sent': False, u'has_extended_profile': False, u'profile_use_background_image': True, u'default_profile_image': False, u'id': 28717351, u'profile_background_image_url_https': u'https://abs.twimg.com/images/themes/theme7/bg.gif', u'verified': False, u'translator_type': u'none', u'profile_text_color': u'0C3E53', u'profile_image_url_https': u'https://pbs.twimg.com/profile_images/1144724910/Sue_Morro_10pequena_normal.jpg', u'profile_sidebar_fill_color': u'F7F2F2', u'entities': {u'url': {u'urls': [{u'url': u'https://t.co/UnioSg1c7F', u'indices': [0, 23], u'expanded_url': u'http://www.gjol.net', u'display_url': u'gjol.net'}]}, u'description': {u'urls': []}}, u'followers_count': 1355, u'profile_sidebar_border_color': u'F7D22D', u'id_str': u'28717351', u'profile_background_color': u'BADFCD', u'listed_count': 65, u'is_translation_enabled': False, u'utc_offset': None, u'statuses_count': 2223, u'description': u'Profa. do Departamento de Comunicação e do PósCom (FACOM/UFBA). Pesquisa Jornalismo, Jornalismo em Base de Dados, Convergência jornalística, Jornalismo Móvel.', u'friends_count': 433, u'location': u'Salvador-BA', u'profile_link_color': u'F78F18', u'profile_image_url': u'http://pbs.twimg.com/profile_images/1144724910/Sue_Morro_10pequena_normal.jpg', u'following': False, u'geo_enabled': True, u'profile_background_image_url': u'http://abs.twimg.com/images/themes/theme7/bg.gif', u'screen_name': u'suzanabarbosa', u'lang': u'pt', u'profile_background_tile': True, u'favourites_count': 1822, u'name': u'suzana barbosa', u'notifications': False, u'url': u'https://t.co/UnioSg1c7F', u'created_at': u'Sat Apr 04 02:18:17 +0000 2009', u'contributors_enabled': False, u'time_zone': None, u'protected': False, u'default_profile': False, u'is_translator': False}",-1.0
28,,,Wed May 30 23:13:41 +0000 2018,"{u'symbols': [], u'user_mentions': [{u'id': 118864905, u'indices': [3, 13], u'id_str': u'118864905', u'screen_name': u'VTVcanal8', u'name': u'VTV CANAL 8'}], u'hashtags': [], u'urls': []}",0,False,,1001964895968034816,1001964895968034816,,,,,,False,es,"{u'iso_language_code': u'es', u'result_type': u'recent'}",,,403,False,"{u'contributors': None, u'truncated': True, u'text': u'INTERNACIONALES | El Tribunal Regional Federal de la Tercera Región de Brasil, ordenó la restitución de sus derecho… https://t.co/49RKnb9FYb', u'is_quote_status': False, u'in_reply_to_status_id': None, u'id': 1001836981532463104, u'favorite_count': 207, u'entities': {u'symbols': [], u'user_mentions': [], u'hashtags': [], u'urls': [{u'url': u'https://t.co/49RKnb9FYb', u'indices': [117, 140], u'expanded_url': u'https://twitter.com/i/web/status/1001836981532463104', u'display_url': u'twitter.com/i/web/status/1\u2026'}]}, u'retweeted': False, u'coordinates': None, u'source': u'<a href=""http://twitter.com"" rel=""nofollow"">Twitter Web Client</a>', u'in_reply_to_screen_name': None, u'in_reply_to_user_id': None, u'retweet_count': 403, u'id_str': u'1001836981532463104', u'favorited': False, u'user': {u'follow_request_sent': False, u'has_extended_profile': True, u'profile_use_background_image': False, u'default_profile_image': False, u'id': 118864905, u'profile_background_image_url_https': u'https://abs.twimg.com/images/themes/theme17/bg.gif', u'verified': True, u'translator_type': u'regular', u'profile_text_color': u'333333', u'profile_image_url_https': u'https://pbs.twimg.com/profile_images/917506292423344129/_5qaXsUk_normal.jpg', u'profile_sidebar_fill_color': u'E6F6F9', u'entities': {u'url': {u'urls': [{u'url': u'https://t.co/m6LaVCRB7I', u'indices': [0, 23], u'expanded_url': u'http://vtv.gob.ve', u'display_url': u'vtv.gob.ve'}]}, u'description': {u'urls': [{u'url': u'https://t.co/a5JJYTXIYk', u'indices': [61, 84], u'expanded_url': u'http://facebook.com/VTVtuCanal', u'display_url': u'facebook.com/VTVtuCanal'}, {u'url': u'https://t.co/ej8nGm7m4t', u'indices': [87, 110], u'expanded_url': u'http://youtube.com/MultimedioVTV', u'display_url': u'youtube.com/MultimedioVTV'}, {u'url': u'https://t.co/hCy05R9VFU', u'indices': [113, 136], u'expanded_url': u'http://instagram.com/VTVcanal8', u'display_url': u'instagram.com/VTVcanal8'}]}}, u'followers_count': 1514220, u'profile_sidebar_border_color': u'000000', u'id_str': u'118864905', u'profile_background_color': u'ABB8C2', u'listed_count': 6327, u'is_translation_enabled': True, u'utc_offset': None, u'statuses_count': 695699, u'description': u'Somos Venezolana de Televisión, 24 horas en vivo | Síguenos  https://t.co/a5JJYTXIYk | https://t.co/ej8nGm7m4t | https://t.co/hCy05R9VFU', u'friends_count': 531, u'location': u'Venezuela', u'profile_link_color': u'1B95E0', u'profile_image_url': u'http://pbs.twimg.com/profile_images/917506292423344129/_5qaXsUk_normal.jpg', u'following': False, u'geo_enabled': True, u'profile_banner_url': u'https://pbs.twimg.com/profile_banners/118864905/1527167189', u'profile_background_image_url': u'http://abs.twimg.com/images/themes/theme17/bg.gif', u'screen_name': u'VTVcanal8', u'lang': u'es', u'profile_background_tile': True, u'favourites_count': 1452, u'name': u'VTV CANAL 8', u'notifications': False, u'url': u'https://t.co/m6LaVCRB7I', u'created_at': u'Mon Mar 01 23:44:14 +0000 2010', u'contributors_enabled': False, u'time_zone': None, u'protected': False, u'default_profile': False, u'is_translator': False}, u'geo': None, u'in_reply_to_user_id_str': None, u'possibly_sensitive': False, u'lang': u'es', u'created_at': u'Wed May 30 14:45:24 +0000 2018', u'in_reply_to_status_id_str': None, u'place': {u'country_code': u'VE', u'url': u'https://api.twitter.com/1.1/geo/id/043383f8b2b79918.json', u'country': u'Venezuela', u'place_type': u'country', u'bounding_box': {u'type': u'Polygon', u'coordinates': [[[-73.3540725, 0.648837], [-59.8037796, 0.648837], [-59.8037796, 12.1968022], [-73.3540725, 12.1968022]]]}, u'contained_within': [], u'full_name': u'Venezuela', u'attributes': {}, u'id': u'043383f8b2b79918', u'name': u'Venezuela'}, u'metadata': {u'iso_language_code': u'es', u'result_type': u'recent'}}","<a href=""https://mobile.twitter.com"" rel=""nofollow"">Mobile Web (M2)</a>","RT @VTVcanal8: INTERNACIONALES | El Tribunal Regional Federal de la Tercera Región de Brasil, ordenó la restitución de sus derechos como ex…",False,"{u'follow_request_sent': False, u'has_extended_profile': True, u'profile_use_background_image': True, u'default_profile_image': False, u'id': 197091106, u'profile_background_image_url_https': u'https://abs.twimg.com/images/themes/theme1/bg.png', u'verified': False, u'translator_type': u'none', u'profile_text_color': u'333333', u'profile_image_url_https': u'https://pbs.twimg.com/profile_images/639994862943760384/VKXh0vyf_normal.jpg', u'profile_sidebar_fill_color': u'DDEEF6', u'entities': {u'description': {u'urls': []}}, u'followers_count': 25, u'profile_sidebar_border_color': u'C0DEED', u'id_str': u'197091106', u'profile_background_color': u'C0DEED', u'listed_count': 0, u'is_translation_enabled': False, u'utc_offset': None, u'statuses_count': 1299, u'description': u'', u'friends_count': 64, u'location': u'', u'profile_link_color': u'1DA1F2', u'profile_image_url': u'http://pbs.twimg.com/profile_images/639994862943760384/VKXh0vyf_normal.jpg', u'following': False, u'geo_enabled': False, u'profile_background_image_url': u'http://abs.twimg.com/images/themes/theme1/bg.png', u'screen_name': u'EvelynAtagua', u'lang': u'es', u'profile_background_tile': False, u'favourites_count': 174, u'name': u'Evelyn Atagua', u'notifications': False, u'url': None, u'created_at': u'Thu Sep 30 16:43:03 +0000 2010', u'contributors_enabled': False, u'time_zone': None, u'protected': False, u'default_profile': True, u'is_translator': False}",0.0
