,contributors,coordinates,created_at,entities,favorite_count,favorited,geo,id,id_str,in_reply_to_screen_name,in_reply_to_status_id,in_reply_to_status_id_str,in_reply_to_user_id,in_reply_to_user_id_str,is_quote_status,lang,metadata,place,possibly_sensitive,retweet_count,retweeted,retweeted_status,source,text,truncated,user,sentimento
46,,,Wed May 30 22:22:53 +0000 2018,"{u'symbols': [], u'user_mentions': [{u'id': 118864905, u'indices': [3, 13], u'id_str': u'118864905', u'screen_name': u'VTVcanal8', u'name': u'VTV CANAL 8'}], u'hashtags': [], u'urls': []}",0,False,,1001952109955289094,1001952109955289094,,,,,,False,es,"{u'iso_language_code': u'es', u'result_type': u'recent'}",,,403,False,"{u'contributors': None, u'truncated': True, u'text': u'INTERNACIONALES | El Tribunal Regional Federal de la Tercera Región de Brasil, ordenó la restitución de sus derecho… https://t.co/49RKnb9FYb', u'is_quote_status': False, u'in_reply_to_status_id': None, u'id': 1001836981532463104, u'favorite_count': 207, u'entities': {u'symbols': [], u'user_mentions': [], u'hashtags': [], u'urls': [{u'url': u'https://t.co/49RKnb9FYb', u'indices': [117, 140], u'expanded_url': u'https://twitter.com/i/web/status/1001836981532463104', u'display_url': u'twitter.com/i/web/status/1\u2026'}]}, u'retweeted': False, u'coordinates': None, u'source': u'<a href=""http://twitter.com"" rel=""nofollow"">Twitter Web Client</a>', u'in_reply_to_screen_name': None, u'in_reply_to_user_id': None, u'retweet_count': 403, u'id_str': u'1001836981532463104', u'favorited': False, u'user': {u'follow_request_sent': False, u'has_extended_profile': True, u'profile_use_background_image': False, u'default_profile_image': False, u'id': 118864905, u'profile_background_image_url_https': u'https://abs.twimg.com/images/themes/theme17/bg.gif', u'verified': True, u'translator_type': u'regular', u'profile_text_color': u'333333', u'profile_image_url_https': u'https://pbs.twimg.com/profile_images/917506292423344129/_5qaXsUk_normal.jpg', u'profile_sidebar_fill_color': u'E6F6F9', u'entities': {u'url': {u'urls': [{u'url': u'https://t.co/m6LaVCRB7I', u'indices': [0, 23], u'expanded_url': u'http://vtv.gob.ve', u'display_url': u'vtv.gob.ve'}]}, u'description': {u'urls': [{u'url': u'https://t.co/a5JJYTXIYk', u'indices': [61, 84], u'expanded_url': u'http://facebook.com/VTVtuCanal', u'display_url': u'facebook.com/VTVtuCanal'}, {u'url': u'https://t.co/ej8nGm7m4t', u'indices': [87, 110], u'expanded_url': u'http://youtube.com/MultimedioVTV', u'display_url': u'youtube.com/MultimedioVTV'}, {u'url': u'https://t.co/hCy05R9VFU', u'indices': [113, 136], u'expanded_url': u'http://instagram.com/VTVcanal8', u'display_url': u'instagram.com/VTVcanal8'}]}}, u'followers_count': 1514220, u'profile_sidebar_border_color': u'000000', u'id_str': u'118864905', u'profile_background_color': u'ABB8C2', u'listed_count': 6327, u'is_translation_enabled': True, u'utc_offset': None, u'statuses_count': 695699, u'description': u'Somos Venezolana de Televisión, 24 horas en vivo | Síguenos  https://t.co/a5JJYTXIYk | https://t.co/ej8nGm7m4t | https://t.co/hCy05R9VFU', u'friends_count': 531, u'location': u'Venezuela', u'profile_link_color': u'1B95E0', u'profile_image_url': u'http://pbs.twimg.com/profile_images/917506292423344129/_5qaXsUk_normal.jpg', u'following': False, u'geo_enabled': True, u'profile_banner_url': u'https://pbs.twimg.com/profile_banners/118864905/1527167189', u'profile_background_image_url': u'http://abs.twimg.com/images/themes/theme17/bg.gif', u'screen_name': u'VTVcanal8', u'lang': u'es', u'profile_background_tile': True, u'favourites_count': 1452, u'name': u'VTV CANAL 8', u'notifications': False, u'url': u'https://t.co/m6LaVCRB7I', u'created_at': u'Mon Mar 01 23:44:14 +0000 2010', u'contributors_enabled': False, u'time_zone': None, u'protected': False, u'default_profile': False, u'is_translator': False}, u'geo': None, u'in_reply_to_user_id_str': None, u'possibly_sensitive': False, u'lang': u'es', u'created_at': u'Wed May 30 14:45:24 +0000 2018', u'in_reply_to_status_id_str': None, u'place': {u'country_code': u'VE', u'url': u'https://api.twitter.com/1.1/geo/id/043383f8b2b79918.json', u'country': u'Venezuela', u'place_type': u'country', u'bounding_box': {u'type': u'Polygon', u'coordinates': [[[-73.3540725, 0.648837], [-59.8037796, 0.648837], [-59.8037796, 12.1968022], [-73.3540725, 12.1968022]]]}, u'contained_within': [], u'full_name': u'Venezuela', u'attributes': {}, u'id': u'043383f8b2b79918', u'name': u'Venezuela'}, u'metadata': {u'iso_language_code': u'es', u'result_type': u'recent'}}","<a href=""http://twitter.com"" rel=""nofollow"">Twitter Web Client</a>","RT @VTVcanal8: INTERNACIONALES | El Tribunal Regional Federal de la Tercera Región de Brasil, ordenó la restitución de sus derechos como ex…",False,"{u'follow_request_sent': False, u'has_extended_profile': False, u'profile_use_background_image': True, u'default_profile_image': True, u'id': 996429684391989248, u'profile_background_image_url_https': None, u'verified': False, u'translator_type': u'none', u'profile_text_color': u'333333', u'profile_image_url_https': u'https://abs.twimg.com/sticky/default_profile_images/default_profile_normal.png', u'profile_sidebar_fill_color': u'DDEEF6', u'entities': {u'description': {u'urls': []}}, u'followers_count': 29, u'profile_sidebar_border_color': u'C0DEED', u'id_str': u'996429684391989248', u'profile_background_color': u'F5F8FA', u'listed_count': 0, u'is_translation_enabled': False, u'utc_offset': None, u'statuses_count': 1170, u'description': u'', u'friends_count': 74, u'location': u'', u'profile_link_color': u'1DA1F2', u'profile_image_url': u'http://abs.twimg.com/sticky/default_profile_images/default_profile_normal.png', u'following': False, u'geo_enabled': False, u'profile_background_image_url': None, u'screen_name': u'maikol87842323', u'lang': u'es', u'profile_background_tile': False, u'favourites_count': 1, u'name': u'maikol', u'notifications': False, u'url': None, u'created_at': u'Tue May 15 16:38:44 +0000 2018', u'contributors_enabled': False, u'time_zone': None, u'protected': False, u'default_profile': True, u'is_translator': False}",0.0
47,,,Wed May 30 22:22:40 +0000 2018,"{u'symbols': [], u'user_mentions': [{u'id': 36413526, u'indices': [3, 15], u'id_str': u'36413526', u'screen_name': u'WinstonLing', u'name': u'Winston Ling'}], u'hashtags': [], u'urls': []}",0,False,,1001952055379005441,1001952055379005441,,,,,,False,pt,"{u'iso_language_code': u'pt', u'result_type': u'recent'}",,,9,False,"{u'contributors': None, u'truncated': True, u'text': u'SÃO PAULO  -  O ex-presidente Luiz Inácio Lula da Silva terá restabelecido os direitos e as prerrogativas garantido… https://t.co/jPUjuxt4Tt', u'is_quote_status': False, u'in_reply_to_status_id': None, u'id': 1001752931790606336, u'favorite_count': 18, u'entities': {u'symbols': [], u'user_mentions': [], u'hashtags': [], u'urls': [{u'url': u'https://t.co/jPUjuxt4Tt', u'indices': [117, 140], u'expanded_url': u'https://twitter.com/i/web/status/1001752931790606336', u'display_url': u'twitter.com/i/web/status/1\u2026'}]}, u'retweeted': False, u'coordinates': None, u'source': u'<a href=""http://www.facebook.com/twitter"" rel=""nofollow"">Facebook</a>', u'in_reply_to_screen_name': None, u'in_reply_to_user_id': None, u'retweet_count': 9, u'id_str': u'1001752931790606336', u'favorited': False, u'user': {u'follow_request_sent': False, u'has_extended_profile': True, u'profile_use_background_image': True, u'default_profile_image': False, u'id': 36413526, u'profile_background_image_url_https': u'https://abs.twimg.com/images/themes/theme1/bg.png', u'verified': False, u'translator_type': u'none', u'profile_text_color': u'333333', u'profile_image_url_https': u'https://pbs.twimg.com/profile_images/634701383929729024/Ux0zWJW0_normal.png', u'profile_sidebar_fill_color': u'DDEEF6', u'entities': {u'url': {u'urls': [{u'url': u'https://t.co/Dus4JqVWyl', u'indices': [0, 23], u'expanded_url': u'https://m.facebook.com/winston.ling', u'display_url': u'm.facebook.com/winston.ling'}]}, u'description': {u'urls': []}}, u'followers_count': 9351, u'profile_sidebar_border_color': u'C0DEED', u'id_str': u'36413526', u'profile_background_color': u'C0DEED', u'listed_count': 90, u'is_translation_enabled': False, u'utc_offset': None, u'statuses_count': 53600, u'description': u'Sincerity, Wisdom, Courage, Sense of Humor, Eyes that see Beauty, Mind that pursues Freedom, Heart that follows Truth and Happiness', u'friends_count': 5047, u'location': u'Shanghai', u'profile_link_color': u'1DA1F2', u'profile_image_url': u'http://pbs.twimg.com/profile_images/634701383929729024/Ux0zWJW0_normal.png', u'following': False, u'geo_enabled': True, u'profile_background_image_url': u'http://abs.twimg.com/images/themes/theme1/bg.png', u'screen_name': u'WinstonLing', u'lang': u'en', u'profile_background_tile': False, u'favourites_count': 42187, u'name': u'Winston Ling', u'notifications': False, u'url': u'https://t.co/Dus4JqVWyl', u'created_at': u'Wed Apr 29 17:20:20 +0000 2009', u'contributors_enabled': False, u'time_zone': None, u'protected': False, u'default_profile': True, u'is_translator': False}, u'geo': None, u'in_reply_to_user_id_str': None, u'possibly_sensitive': False, u'lang': u'pt', u'created_at': u'Wed May 30 09:11:25 +0000 2018', u'in_reply_to_status_id_str': None, u'place': None, u'metadata': {u'iso_language_code': u'pt', u'result_type': u'recent'}}","<a href=""http://twitter.com/download/android"" rel=""nofollow"">Twitter for Android</a>",RT @WinstonLing: SÃO PAULO  -  O ex-presidente Luiz Inácio Lula da Silva terá restabelecido os direitos e as prerrogativas garantidos aos e…,False,"{u'follow_request_sent': False, u'has_extended_profile': False, u'profile_use_background_image': True, u'default_profile_image': False, u'id': 2810514987, u'profile_background_image_url_https': u'https://abs.twimg.com/images/themes/theme1/bg.png', u'verified': False, u'translator_type': u'none', u'profile_text_color': u'333333', u'profile_image_url_https': u'https://pbs.twimg.com/profile_images/771790457114398720/jH89cfYy_normal.jpg', u'profile_sidebar_fill_color': u'DDEEF6', u'entities': {u'description': {u'urls': []}}, u'followers_count': 183, u'profile_sidebar_border_color': u'C0DEED', u'id_str': u'2810514987', u'profile_background_color': u'C0DEED', u'listed_count': 2, u'is_translation_enabled': False, u'utc_offset': None, u'statuses_count': 19181, u'description': u'', u'friends_count': 189, u'location': u'', u'profile_link_color': u'1DA1F2', u'profile_image_url': u'http://pbs.twimg.com/profile_images/771790457114398720/jH89cfYy_normal.jpg', u'following': False, u'geo_enabled': False, u'profile_background_image_url': u'http://abs.twimg.com/images/themes/theme1/bg.png', u'screen_name': u'LucianitaW', u'lang': u'pt', u'profile_background_tile': False, u'favourites_count': 9835, u'name': u'Lucianita', u'notifications': False, u'url': None, u'created_at': u'Mon Oct 06 15:29:22 +0000 2014', u'contributors_enabled': False, u'time_zone': None, u'protected': False, u'default_profile': True, u'is_translator': False}",2.0
48,,,Wed May 30 22:20:02 +0000 2018,"{u'symbols': [], u'user_mentions': [], u'hashtags': [], u'urls': []}",0,False,,1001951394625196033,1001951394625196033,,,,,,False,pt,"{u'iso_language_code': u'pt', u'result_type': u'recent'}",,,0,False,,"<a href=""http://www.igoroliveira.org"" rel=""nofollow"">Setenca</a>",160. Fosse ainda Luiz Inácio Lula da Silva Presidente da República a competência seria do Egrégio Supremo Tribunal (1/2),False,"{u'follow_request_sent': False, u'has_extended_profile': True, u'profile_use_background_image': True, u'default_profile_image': False, u'id': 707988817454747650, u'profile_background_image_url_https': None, u'verified': False, u'translator_type': u'none', u'profile_text_color': u'333333', u'profile_image_url_https': u'https://pbs.twimg.com/profile_images/885992665019543552/JmEHt5m8_normal.jpg', u'profile_sidebar_fill_color': u'DDEEF6', u'entities': {u'description': {u'urls': []}}, u'followers_count': 70, u'profile_sidebar_border_color': u'C0DEED', u'id_str': u'707988817454747650', u'profile_background_color': u'F5F8FA', u'listed_count': 1, u'is_translation_enabled': False, u'utc_offset': None, u'statuses_count': 64471, u'description': u'Quem sou eu pra julgar? Irmão mais novo do @tesemercadante.', u'friends_count': 1, u'location': u'Curitiba, Brazil', u'profile_link_color': u'1DA1F2', u'profile_image_url': u'http://pbs.twimg.com/profile_images/885992665019543552/JmEHt5m8_normal.jpg', u'following': False, u'geo_enabled': False, u'profile_banner_url': u'https://pbs.twimg.com/profile_banners/707988817454747650/1500072107', u'profile_background_image_url': None, u'screen_name': u'em_fasciculos', u'lang': u'en-gb', u'profile_background_tile': False, u'favourites_count': 7, u'name': u'The People vs Lula', u'notifications': False, u'url': None, u'created_at': u'Thu Mar 10 17:57:42 +0000 2016', u'contributors_enabled': False, u'time_zone': None, u'protected': False, u'default_profile': True, u'is_translator': False}",3.0
49,,,Wed May 30 22:19:24 +0000 2018,"{u'symbols': [], u'user_mentions': [{u'id': 118864905, u'indices': [3, 13], u'id_str': u'118864905', u'screen_name': u'VTVcanal8', u'name': u'VTV CANAL 8'}], u'hashtags': [], u'urls': []}",0,False,,1001951235476467712,1001951235476467712,,,,,,False,es,"{u'iso_language_code': u'es', u'result_type': u'recent'}",,,403,False,"{u'contributors': None, u'truncated': True, u'text': u'INTERNACIONALES | El Tribunal Regional Federal de la Tercera Región de Brasil, ordenó la restitución de sus derecho… https://t.co/49RKnb9FYb', u'is_quote_status': False, u'in_reply_to_status_id': None, u'id': 1001836981532463104, u'favorite_count': 207, u'entities': {u'symbols': [], u'user_mentions': [], u'hashtags': [], u'urls': [{u'url': u'https://t.co/49RKnb9FYb', u'indices': [117, 140], u'expanded_url': u'https://twitter.com/i/web/status/1001836981532463104', u'display_url': u'twitter.com/i/web/status/1\u2026'}]}, u'retweeted': False, u'coordinates': None, u'source': u'<a href=""http://twitter.com"" rel=""nofollow"">Twitter Web Client</a>', u'in_reply_to_screen_name': None, u'in_reply_to_user_id': None, u'retweet_count': 403, u'id_str': u'1001836981532463104', u'favorited': False, u'user': {u'follow_request_sent': False, u'has_extended_profile': True, u'profile_use_background_image': False, u'default_profile_image': False, u'id': 118864905, u'profile_background_image_url_https': u'https://abs.twimg.com/images/themes/theme17/bg.gif', u'verified': True, u'translator_type': u'regular', u'profile_text_color': u'333333', u'profile_image_url_https': u'https://pbs.twimg.com/profile_images/917506292423344129/_5qaXsUk_normal.jpg', u'profile_sidebar_fill_color': u'E6F6F9', u'entities': {u'url': {u'urls': [{u'url': u'https://t.co/m6LaVCRB7I', u'indices': [0, 23], u'expanded_url': u'http://vtv.gob.ve', u'display_url': u'vtv.gob.ve'}]}, u'description': {u'urls': [{u'url': u'https://t.co/a5JJYTXIYk', u'indices': [61, 84], u'expanded_url': u'http://facebook.com/VTVtuCanal', u'display_url': u'facebook.com/VTVtuCanal'}, {u'url': u'https://t.co/ej8nGm7m4t', u'indices': [87, 110], u'expanded_url': u'http://youtube.com/MultimedioVTV', u'display_url': u'youtube.com/MultimedioVTV'}, {u'url': u'https://t.co/hCy05R9VFU', u'indices': [113, 136], u'expanded_url': u'http://instagram.com/VTVcanal8', u'display_url': u'instagram.com/VTVcanal8'}]}}, u'followers_count': 1514220, u'profile_sidebar_border_color': u'000000', u'id_str': u'118864905', u'profile_background_color': u'ABB8C2', u'listed_count': 6327, u'is_translation_enabled': True, u'utc_offset': None, u'statuses_count': 695699, u'description': u'Somos Venezolana de Televisión, 24 horas en vivo | Síguenos  https://t.co/a5JJYTXIYk | https://t.co/ej8nGm7m4t | https://t.co/hCy05R9VFU', u'friends_count': 531, u'location': u'Venezuela', u'profile_link_color': u'1B95E0', u'profile_image_url': u'http://pbs.twimg.com/profile_images/917506292423344129/_5qaXsUk_normal.jpg', u'following': False, u'geo_enabled': True, u'profile_banner_url': u'https://pbs.twimg.com/profile_banners/118864905/1527167189', u'profile_background_image_url': u'http://abs.twimg.com/images/themes/theme17/bg.gif', u'screen_name': u'VTVcanal8', u'lang': u'es', u'profile_background_tile': True, u'favourites_count': 1452, u'name': u'VTV CANAL 8', u'notifications': False, u'url': u'https://t.co/m6LaVCRB7I', u'created_at': u'Mon Mar 01 23:44:14 +0000 2010', u'contributors_enabled': False, u'time_zone': None, u'protected': False, u'default_profile': False, u'is_translator': False}, u'geo': None, u'in_reply_to_user_id_str': None, u'possibly_sensitive': False, u'lang': u'es', u'created_at': u'Wed May 30 14:45:24 +0000 2018', u'in_reply_to_status_id_str': None, u'place': {u'country_code': u'VE', u'url': u'https://api.twitter.com/1.1/geo/id/043383f8b2b79918.json', u'country': u'Venezuela', u'place_type': u'country', u'bounding_box': {u'type': u'Polygon', u'coordinates': [[[-73.3540725, 0.648837], [-59.8037796, 0.648837], [-59.8037796, 12.1968022], [-73.3540725, 12.1968022]]]}, u'contained_within': [], u'full_name': u'Venezuela', u'attributes': {}, u'id': u'043383f8b2b79918', u'name': u'Venezuela'}, u'metadata': {u'iso_language_code': u'es', u'result_type': u'recent'}}","<a href=""http://twitter.com"" rel=""nofollow"">Twitter Web Client</a>","RT @VTVcanal8: INTERNACIONALES | El Tribunal Regional Federal de la Tercera Región de Brasil, ordenó la restitución de sus derechos como ex…",False,"{u'follow_request_sent': False, u'has_extended_profile': True, u'profile_use_background_image': True, u'default_profile_image': False, u'id': 144142797, u'profile_background_image_url_https': u'https://abs.twimg.com/images/themes/theme6/bg.gif', u'verified': False, u'translator_type': u'none', u'profile_text_color': u'FF3300', u'profile_image_url_https': u'https://pbs.twimg.com/profile_images/485228518385532928/8FoUjkSs_normal.jpeg', u'profile_sidebar_fill_color': u'A0C5C7', u'entities': {u'url': {u'urls': [{u'url': u'https://t.co/HrntrgCcu7', u'indices': [0, 23], u'expanded_url': u'http://frenterevolucactivadoresculturales.blogspot.com', u'display_url': u'\u2026lucactivadoresculturales.blogspot.com'}]}, u'description': {u'urls': []}}, u'followers_count': 6035, u'profile_sidebar_border_color': u'FFFFFF', u'id_str': u'144142797', u'profile_background_color': u'709397', u'listed_count': 20, u'is_translation_enabled': False, u'utc_offset': None, u'statuses_count': 13795, u'description': u'Revolucionario x convicción, defensor dl  legado dl Gigante Eterno, luchador constante x ls valores éticos, humanistas, solidaridarios y compromet. cn el pueblo', u'friends_count': 6170, u'location': u'Venezuela', u'profile_link_color': u'333333', u'profile_image_url': u'http://pbs.twimg.com/profile_images/485228518385532928/8FoUjkSs_normal.jpeg', u'following': False, u'geo_enabled': True, u'profile_banner_url': u'https://pbs.twimg.com/profile_banners/144142797/1404523064', u'profile_background_image_url': u'http://abs.twimg.com/images/themes/theme6/bg.gif', u'screen_name': u'aviladmed', u'lang': u'es', u'profile_background_tile': True, u'favourites_count': 17, u'name': u'Edgar Mayorga', u'notifications': False, u'url': u'https://t.co/HrntrgCcu7', u'created_at': u'Sat May 15 12:25:07 +0000 2010', u'contributors_enabled': False, u'time_zone': None, u'protected': False, u'default_profile': False, u'is_translator': False}",0.0
50,,,Wed May 30 22:18:22 +0000 2018,"{u'symbols': [], u'user_mentions': [{u'id': 111123176, u'indices': [3, 19], u'id_str': u'111123176', u'screen_name': u'jeanwyllys_real', u'name': u'Jean Wyllys'}], u'hashtags': [], u'urls': []}",0,False,,1001950973865185280,1001950973865185280,,,,,,False,pt,"{u'iso_language_code': u'pt', u'result_type': u'recent'}",,,213,False,"{u'contributors': None, u'truncated': True, u'text': u'300 acadêmicos e intelectuais lançaram um manifesto  denunciando a prisão do ex-presidente Luiz Inácio Lula da Silv… https://t.co/t0fceWR0pE', u'is_quote_status': False, u'in_reply_to_status_id': None, u'id': 1001629096638631936, u'favorite_count': 692, u'entities': {u'symbols': [], u'user_mentions': [], u'hashtags': [], u'urls': [{u'url': u'https://t.co/t0fceWR0pE', u'indices': [117, 140], u'expanded_url': u'https://twitter.com/i/web/status/1001629096638631936', u'display_url': u'twitter.com/i/web/status/1\u2026'}]}, u'retweeted': False, u'coordinates': None, u'source': u'<a href=""http://twitter.com/download/android"" rel=""nofollow"">Twitter for Android</a>', u'in_reply_to_screen_name': None, u'in_reply_to_user_id': None, u'retweet_count': 213, u'id_str': u'1001629096638631936', u'favorited': False, u'user': {u'follow_request_sent': False, u'has_extended_profile': False, u'profile_use_background_image': True, u'default_profile_image': False, u'id': 111123176, u'profile_background_image_url_https': u'https://abs.twimg.com/images/themes/theme1/bg.png', u'verified': True, u'translator_type': u'none', u'profile_text_color': u'333333', u'profile_image_url_https': u'https://pbs.twimg.com/profile_images/974363284295077890/DRBkhPqv_normal.jpg', u'profile_sidebar_fill_color': u'DDEEF6', u'entities': {u'url': {u'urls': [{u'url': u'https://t.co/SCfeqdpVBC', u'indices': [0, 23], u'expanded_url': u'http://bit.ly/FinancieJeanWyllys', u'display_url': u'bit.ly/FinancieJeanWy\u2026'}]}, u'description': {u'urls': []}}, u'followers_count': 706215, u'profile_sidebar_border_color': u'C0DEED', u'id_str': u'111123176', u'profile_background_color': u'C0DEED', u'listed_count': 2345, u'is_translation_enabled': False, u'utc_offset': None, u'statuses_count': 65094, u'description': u'Jornalista, professor universitário e escritor baiano. Pré-candidato a deputado federal pelo PSOL-RJ.
Doe aqui 👇 para a nossa futura campanha!', u'friends_count': 711, u'location': u'Rio de Janeiro', u'profile_link_color': u'3B94D9', u'profile_image_url': u'http://pbs.twimg.com/profile_images/974363284295077890/DRBkhPqv_normal.jpg', u'following': False, u'geo_enabled': True, u'profile_banner_url': u'https://pbs.twimg.com/profile_banners/111123176/1526939321', u'profile_background_image_url': u'http://abs.twimg.com/images/themes/theme1/bg.png', u'screen_name': u'jeanwyllys_real', u'lang': u'pt', u'profile_background_tile': True, u'favourites_count': 855, u'name': u'Jean Wyllys', u'notifications': False, u'url': u'https://t.co/SCfeqdpVBC', u'created_at': u'Wed Feb 03 21:58:06 +0000 2010', u'contributors_enabled': False, u'time_zone': None, u'protected': False, u'default_profile': False, u'is_translator': False}, u'geo': None, u'in_reply_to_user_id_str': None, u'possibly_sensitive': False, u'lang': u'pt', u'created_at': u'Wed May 30 00:59:20 +0000 2018', u'in_reply_to_status_id_str': None, u'place': None, u'metadata': {u'iso_language_code': u'pt', u'result_type': u'recent'}}","<a href=""http://twitter.com/download/iphone"" rel=""nofollow"">Twitter for iPhone</a>",RT @jeanwyllys_real: 300 acadêmicos e intelectuais lançaram um manifesto  denunciando a prisão do ex-presidente Luiz Inácio Lula da Silva.…,False,"{u'follow_request_sent': False, u'has_extended_profile': False, u'profile_use_background_image': True, u'default_profile_image': False, u'id': 467570943, u'profile_background_image_url_https': u'https://abs.twimg.com/images/themes/theme19/bg.gif', u'verified': False, u'translator_type': u'none', u'profile_text_color': u'333333', u'profile_image_url_https': u'https://pbs.twimg.com/profile_images/1764416727/SANY7855_normal.JPG', u'profile_sidebar_fill_color': u'F6FFD1', u'entities': {u'url': {u'urls': [{u'url': u'http://t.co/O85ic0CDgD', u'indices': [0, 22], u'expanded_url': u'http://www.chitadasilva.com.br', u'display_url': u'chitadasilva.com.br'}]}, u'description': {u'urls': []}}, u'followers_count': 75, u'profile_sidebar_border_color': u'FFF8AD', u'id_str': u'467570943', u'profile_background_color': u'FFF04D', u'listed_count': 0, u'is_translation_enabled': False, u'utc_offset': None, u'statuses_count': 1019, u'description': u'Se você é apaixonada como eu por esse tecido, seja bem-vindo à CHITA da SILVA! 
Se ainda não é, vai ver como é fácil se encantar!', u'friends_count': 479, u'location': u'São paulo', u'profile_link_color': u'0099CC', u'profile_image_url': u'http://pbs.twimg.com/profile_images/1764416727/SANY7855_normal.JPG', u'following': False, u'geo_enabled': True, u'profile_background_image_url': u'http://abs.twimg.com/images/themes/theme19/bg.gif', u'screen_name': u'chitadasilva', u'lang': u'pt', u'profile_background_tile': False, u'favourites_count': 881, u'name': u'Helô Martins', u'notifications': False, u'url': u'http://t.co/O85ic0CDgD', u'created_at': u'Wed Jan 18 16:22:18 +0000 2012', u'contributors_enabled': False, u'time_zone': None, u'protected': False, u'default_profile': False, u'is_translator': False}",-1.0
